[
  {
    "Type": "BSP",
    "Document": "BSP1",
    "Description": "Acier Picard",
    "DocumentMaitre": "",
    "TypeDocumentMaitre": "",
    "Intervenant": "F00190",
    "NomIntervenant": "Acier Picard",
    "Statut": "ACT",
    "DateDocument": "2022-06-07",
    "DateCreation": "2022-06-07",
    "UsagerResponsable": "MATPER",
    "UsagerInscripteur": "WEBSTP",
    "DateModification": "2022-06-07",
    "UsagerModificateur": "MATPER",
    "Reference1": "BSP1",
    "Reference2": "BSP1",
    "Contact": "",
    "Territoire": "CA-QC",
    "LivraisonTransporteur": "",
    "LivraisonDateFin": "",
    "CommentaireGeneral": "",
    "RetenueCommande": "N",
    "TypeRetenue": "N",
    "Conditions": "",
    "AdresseLivraison": "",
    "VilleLivraison": "",
    "ProvinceLivraison": "",
    "CodePostal": "",
    "AdresseFacturation": "",
    "VilleFacturation": "",
    "ProvinceFacturation": "",
    "CodePostalFacturation": "",
    "CompagnieSource": "001",
    "CompagnieDestination": "001",
    "FrequenceFacturation": "N",
    "DateDebutFrequence": "",
    "Devise": "CAD",
    "SousTotal": "0",
    "MontantAjustement": "0",
    "MontantTaxe1": "0",
    "MontantTaxe2": "0",
    "LivraisonDateDebut": "",
    "AdresseLivraisonLigne2": "",
    "PaysLivraison": "",
    "AdresseFacturationLigne2": "",
    "PaysFacturation": "",
    "DateDerniereImpression": "",
    "LangueIntervenant": "FRA",
    "Facture": "",
    "Prefixe": "BSP",
    "DateFacture": "",
    "MontantRetenue": "0",
    "FrequencePeriode": "0",
    "DateFinFrequence": "",
    "DatePremiereFrequence": "",
    "SousTotalTransaction2": "0",
    "MontantAjustementTransaction2": "0",
    "MontantTaxe1Transaction2": "0",
    "MontantTaxe2Transaction2": "0",
    "MontantRetenueTransaction2": "0",
    "MontantDejaTraiteMaitre": "0",
    "ImpressionSommaire": "N",
    "Reference3": "",
    "Reference4": "",
    "Reference5": "",
    "FrequenceDescription": "",
    "Description2": "",
    "DossierFacturation": "F00166",
    "DescriptionFacturation": "Acier Altitube Inc.",
    "Description2Facturation": "",
    "ContactFacturation": "Nicolas Couvrette Roy",
    "DossierLivraison": "F00166",
    "DescriptionLivraison": "Acier Altitube Inc.",
    "Description2Livraison": "",
    "ContactLivraison": "Nicolas Couvrette Roy",
    "SousTotalDejaTraiteMaitre": "0",
    "MontantSuspens": "0",
    "TypeDocumentEngagement": "BSP",
    "DocumentEngagement": "BSP1",
    "IdentifiantUnique": "",
    "LivraisonDateDebutReelle": "",
    "LivraisonDateReelle": "",
    "FrequenceImpressionDescription": "",
    "FrequenceImpressionPeriode": "0",
    "FrequenceImpression": "N",
    "DateDebutDerniereImpression": "",
    "DateFinDerniereImpression": "",
    "DatePremiereImpression": "",
    "DateDenonciation": "",
    "MontantDenonce": "0",
    "QuittanceRecue": "0",
    "QuittanceRecevoir": "0",
    "MiseJour": "A",
    "TelephoneContact": "",
    "TelephoneFacturation":"",
    "TelephoneLivraison": "",
    "TypeIntervenant": "FOU",
    "TypeIntervenantFacturation": "FOU",
    "TypeIntervenantLivraison": "FOU",
    "CompagnieIntervenant": "",
    "CompagnieIntervenantFacturation": "",
    "CompagnieIntervenantLivraison": "",
    "CompagnieLiee": "001",
    "Consolidation": "I",
    "Reference6": "",
    "Reference7": "",
    "Reference8": "",
    "Reference9": "",
    "Reference10": "",
    "Reference11": "",
    "Reference12": "",
    "Reference13": "",
    "Reference14": "",
    "Reference15": "",
    "Succursale": "",
    "VersionRecord": "",
    "TimestampDerniereSauvegarde": "2022-06-07 hh:mm:ss",
    "Projet": "0867",
    "TypeGeneration": "",
    "RevisionDocument": "",
    "Num√©roFactureATraiter": "",
    "DateFactureATraiter": "",
    "DateTransactionFactureATraiter": "",
    "DateDebutDocument": "",
    "DateFinDocument": ""
  }
]